[
    {
        "payslipId": "ps01",
        "empId": "1234",
        "calendarGroupId": "345",
        "gpSourceProduct": "gpSourceProduct01",
        "paymentDate": "2015-06-01",
        "periodBeginDate": "2015-05-01",
        "periodEndDate": "2015-06-30",
        "grossPay": 321.5,
        "netPay": 250,
        "grossTax": 71.5,
        "description": "May payslip"
    },
    {
        "payslipId": "ps01",
        "empId": "1234",
        "calendarGroupId": "345",
        "gpSourceProduct": "gpSourceProduct01",
        "paymentDate": "2015-06-01",
        "periodBeginDate": "2015-05-01",
        "periodEndDate": "2015-06-30",
        "grossPay": 321.5,
        "netPay": 250,
        "grossTax": 71.5,
        "description": "May payslip"
    }
]